{
  "profile_class": "machine",
  "slicer": "orcaslicer",
  "setting_id": "GM_BBL_X1C_04",
  "name": "Bambu Lab X1 Carbon 0.4 nozzle",
  "inherits": "fdm_bbl_x1_common",
  "vendor_slug": "bambulab",
  "machine_ref": { "vendor_slug": "bambulab", "model": "X1 Carbon" },
  "params": {
    "build_volume_mm": { "x": 256, "y": 256, "z": 256 },
    "kinematics": "corexy",
    "nozzle_diameter_mm": 0.4,
    "max_nozzle_temp_c": 300,
    "max_bed_temp_c": 120,
    "has_heated_chamber": true,
    "extruder_type": "direct_drive",
    "gcode_flavor": "marlin"
  },
  "source": {
    "name": "softfever_orcaslicer",
    "url": "https://github.com/SoftFever/OrcaSlicer",
    "ref": "resources/profiles/BBL/machine/Bambu Lab X1 Carbon 0.4 nozzle.json",
    "license": "AGPL-3.0"
  },
  "confidence": 1,
  "schema_version": 1
}
